created_at,tweet_id,text,language,type,bookmark_count,favorite_count,retweet_count,reply_count,view_count,client,hashtags,urls,media_type,media_urls
3/23/24 9:13,'1771450059269317106',@belfield_chris this is the clean hoodie,en,Reply,1,430,2,3,17830,"<a href=""https://mobile.twitter.com"" rel=""nofollow"">Twitter Web App</a>",,,,
3/23/24 3:19,'1771361145070510095',a great film for outerwear https://t.co/xWj9Yvcao3,en,Tweet,217,1744,98,27,208885,"<a href=""https://mobile.twitter.com"" rel=""nofollow"">Twitter Web App</a>",,,photo,"https://pbs.twimg.com/media/GJUjdQgbMAAzbba.jpg,https://pbs.twimg.com/media/GJUjdQibUAAEMcu.png,https://pbs.twimg.com/media/GJUjdQiaoAA2LBW.png,https://pbs.twimg.com/media/GJUjdQgbwAA-xpl.jpg"
3/22/24 18:28,'1771227432504197330',"Me at 6 years old, watching Mister Rogers' Neighborhood: ""Noo, Mister Rogers, don't hang your cardigans, they'll stretch out."" https://t.co/65utGrEJuc",en,Tweet,234,14225,381,63,394532,"<a href=""https://mobile.twitter.com"" rel=""nofollow"">Twitter Web App</a>",,,photo,https://pbs.twimg.com/media/GJSp7uza8AANRN0.jpg
3/23/24 2:20,'1771346314032455838',@Bohemiangirl this you? https://t.co/xHKUmb8cZe,en,Reply,1,226,2,1,5591,"<a href=""https://mobile.twitter.com"" rel=""nofollow"">Twitter Web App</a>",,,photo,https://pbs.twimg.com/media/GJUWFFVaYAAW3Mg.jpg
3/23/24 0:05,'1771312252215574770',candace owens this. candace owens that. i wanna know can dis menswear guy own some housing,en,Tweet,36,4629,107,41,218052,"<a href=""https://mobile.twitter.com"" rel=""nofollow"">Twitter Web App</a>",,,,
3/22/24 23:10,'1771298345480536107',@Morgrid1 @TradrGator MMMmm Deez nuts,en,Reply,1,287,3,1,6760,"<a href=""https://mobile.twitter.com"" rel=""nofollow"">Twitter Web App</a>",,,,
3/22/24 22:32,'1771288744961647045',@chrsdcook i support the building of affordable housing and once got a NIMBY to delete his account https://t.co/m5YuI14IBC,en,Reply,1,259,2,7,28460,"<a href=""https://mobile.twitter.com"" rel=""nofollow"">Twitter Web App</a>",,,photo,"https://pbs.twimg.com/media/GJThteoWcAAolsK.jpg,https://pbs.twimg.com/media/GJThteHbIAABd0g.jpg"
3/22/24 21:32,'1771273795078406206',"There's no way to test this because there's no counterfactual. 

We have one outcome: she landed a job at the NYT to create content. Clearly, they hired her partly because of her education. But could she have gotten the same job with fewer degrees?

There are two ways to test this. You could go back in time and remove one or two degrees—or have her get a totally different degree (PhD)—and see if she still lands the same job. 

Or you could have a pool of people with similar jobs (although drawing such comparisons will be tough) and compare their qualifications. 

Whether you, as an outsider who is not an expert in this field, think that 3 terminal MAs are redundant has little relevance to the outcome (her landing a job), as you are not the person hiring her.",en,Reply,0,8,1,1,701,"<a href=""https://mobile.twitter.com"" rel=""nofollow"">Twitter Web App</a>",,,,
3/22/24 21:16,'1771269844605809099',"@neilgaynor @mallorylayne @tubpatrol1 Depending on the field, a PhD mostly prepares you for academic research. If you are not interested in that kind of work, you should not get a PhD. From this person's bio, it seems they were interested in more applied work.",en,Reply,0,9,1,1,457,"<a href=""https://mobile.twitter.com"" rel=""nofollow"">Twitter Web App</a>",,,,
3/22/24 20:56,'1771264731631727084',@TradrGator What's the abbreviation for when you have a degree in medicine?,en,Reply,0,256,1,1,17354,"<a href=""https://mobile.twitter.com"" rel=""nofollow"">Twitter Web App</a>",,,,
3/22/24 20:44,'1771261813251842405',@septboules I'm confused by how 2011 to 2019 equals four years.,en,Reply,2,646,1,1,23538,"<a href=""https://mobile.twitter.com"" rel=""nofollow"">Twitter Web App</a>",,,,
3/22/24 19:23,'1771241275179569644',"i dont know the reason, but when you are diagnosed with something serious, even if it's clearly not your fault, you are very reluctant to share it. obviously she's a public figure, but sharing this sort of news with the world is crazy to me https://t.co/lHcT1wnIwh",en,Tweet,49,2293,53,102,215253,"<a href=""https://mobile.twitter.com"" rel=""nofollow"">Twitter Web App</a>",,,photo,https://pbs.twimg.com/media/GJS2bikaMAA2-U7.png
3/22/24 19:41,'1771245832542494852',@trefenten @dkj_se What a stupid thing to get blocked over. I don't even care about these people.,en,Reply,0,25,1,1,1314,"<a href=""https://mobile.twitter.com"" rel=""nofollow"">Twitter Web App</a>",,,,
3/22/24 19:36,'1771244620992729176',@trefenten @dkj_se would you also like to see her underwear?,en,Reply,1,82,1,6,3502,"<a href=""https://mobile.twitter.com"" rel=""nofollow"">Twitter Web App</a>",,,,
3/22/24 19:35,'1771244260618113203',"@sgtwaddles42 I think it's quite different. I care about the President's medical history because they can bomb a nation. To me, the royal family is just celebs, like Paris Hilton or Kim Kardashian.",en,Reply,1,153,1,14,6444,"<a href=""https://mobile.twitter.com"" rel=""nofollow"">Twitter Web App</a>",,,,
3/22/24 19:29,'1771242937554284598',"@JHalgaard @fraac1 again, i dont care either way. it's just crazy to me what people think they have a right to. i don't care about any celebs, let alone British ones",en,Reply,0,21,1,4,1908,"<a href=""https://mobile.twitter.com"" rel=""nofollow"">Twitter Web App</a>",,,,
3/22/24 19:28,'1771242613930160263',"@dkj_se surely you can imagine that even public figures should have some sphere of privacy, like their sex life or toilet practices.",en,Reply,2,250,2,11,7166,"<a href=""https://mobile.twitter.com"" rel=""nofollow"">Twitter Web App</a>",,,,
3/22/24 19:26,'1771242147913531694',"@fraac1 im not british so it's not my business, and frankly, i don't care either way, but thinking that you have a right to someone's medical history is also crazy to me",en,Reply,2,194,6,3,5838,"<a href=""https://mobile.twitter.com"" rel=""nofollow"">Twitter Web App</a>",,,,
3/22/24 18:33,'1771228788744912988',"@Rafalbores yes, knits should always be folded, not hung.",en,Reply,41,550,10,11,10850,"<a href=""https://mobile.twitter.com"" rel=""nofollow"">Twitter Web App</a>",,,,
3/22/24 16:56,'1771204403250291016',the GOP used to look a lot better https://t.co/0VRTdr9gaW,en,Tweet,326,5095,219,215,641594,"<a href=""https://mobile.twitter.com"" rel=""nofollow"">Twitter Web App</a>",,,photo,"https://pbs.twimg.com/media/GJSU65XbUAAbF4S.jpg,https://pbs.twimg.com/media/GJSUgIwaYAAHW0V.jpg"
3/22/24 17:14,'1771208951268569358',"@maxprat if you buy quality leather shoes (full grain leather, not corrected grain) and polish them, then day one",en,Reply,3,43,2,2,4226,"<a href=""https://mobile.twitter.com"" rel=""nofollow"">Twitter Web App</a>",,,,
3/22/24 5:35,'1771032937502507330',"Fred Rogers is rightly celebrated for his style, but less well-recognized are the reasons why his style worked so well over the years. 🧵",en,Tweet,5978,18591,1709,86,4026943,"<a href=""https://mobile.twitter.com"" rel=""nofollow"">Twitter Web App</a>",,,,
3/22/24 7:13,'1771057549086773396',@1258632 https://t.co/7ute15nBlG,qme,Reply,582,484,14,3,30837,"<a href=""https://mobile.twitter.com"" rel=""nofollow"">Twitter Web App</a>",,https://dieworkwear.com/2022/08/26/how-to-develop-good-taste-pt-1/,,
3/22/24 5:35,'1771033004464579049',"That's made much easier if you pay attention to things such as fit, silhouette, and proportions. And if you dabble in trends, have a strong enough sense of personal style to still wear the thing even after the trend passes.",en,Reply,23,1186,21,4,94951,"<a href=""https://mobile.twitter.com"" rel=""nofollow"">Twitter Web App</a>",,,,
3/22/24 5:35,'1771033006008074409',"Rogers' style was great because he understood some very basic principles, which allowed him to create a consistent look that aged well over the 33 years the show aired. You can watch any episode today—some now over 55 years old—and say, ""That guy looks great."" Pretty awesome. https://t.co/zAe7CQEOk1",en,Reply,44,2536,59,30,97589,"<a href=""https://mobile.twitter.com"" rel=""nofollow"">Twitter Web App</a>",,,photo,"https://pbs.twimg.com/media/GJP3N2RbQAAW8up.png,https://pbs.twimg.com/media/GJP3QOSa0AAf7k3.jpg"
3/22/24 5:35,'1771033000010293517',"I don't mean that everyone has to dress in such a classic manner. Only that, there is something powerful about people who have developed a very strong sense of personal style. This can include a very broad scope of aesthetics. These men had the same look for decades: https://t.co/wwrbD0u7DH",en,Reply,86,1799,48,11,78358,"<a href=""https://mobile.twitter.com"" rel=""nofollow"">Twitter Web App</a>",,,photo,"https://pbs.twimg.com/media/GJP0MjjbsAAxN4O.jpg,https://pbs.twimg.com/media/GJP0Mjja8AALUkQ.jpg,https://pbs.twimg.com/media/GJP0Mm4awAAMTq2.jpg,https://pbs.twimg.com/media/GJP0MmtbMAAAb3J.jpg"
3/21/24 20:53,'1770901613257134209',this is what you look like when you wear a suit jacket with jeans,en,Tweet,408,13498,786,193,707582,"<a href=""https://mobile.twitter.com"" rel=""nofollow"">Twitter Web App</a>",,,,
3/22/24 2:51,'1770991715484352840',@Gloam71119760 both are unisex https://t.co/ZwCPcSYO5g,en,Reply,1,6,1,1,1391,"<a href=""https://mobile.twitter.com"" rel=""nofollow"">Twitter Web App</a>",,,photo,"https://pbs.twimg.com/media/GJPTkz0bIAAM7AS.jpg,https://pbs.twimg.com/media/GJPTkzzbEAAznrd.jpg"
3/22/24 1:58,'1770978218738356536',"I once went to a film screening by an Asian indie director and then attended the afterparty, and since I was one of the only Asian people there, people came up to congratulate me, and I just rode with it. Felt like a superstar",en,Tweet,214,2900,63,28,371652,"<a href=""https://mobile.twitter.com"" rel=""nofollow"">Twitter Web App</a>",,,,
3/21/24 20:26,'1770894860880359769',That’s a new one 😂 https://t.co/KI0ZSUfFZ2,en,Retweet,8487,79034,8602,242,3214305,"<a href=""http://twitter.com/download/iphone"" rel=""nofollow"">Twitter for iPhone</a>",,,video,https://video.twimg.com/amplify_video/1770894798578122752/vid/avc1/576x1024/qw6ZmWgwVFuWSvLT.mp4?tag=14
3/21/24 6:09,'1770679059699343675',"IMO, it's more important to develop a sense of taste than to obsess over things like quality or even price. How much should you spend on a suit, assuming money is no object? It depends on what you want. 🧵",en,Tweet,1258,6698,241,41,1946401,"<a href=""https://mobile.twitter.com"" rel=""nofollow"">Twitter Web App</a>",,,,
3/21/24 23:35,'1770942368117821523',@mdedora https://t.co/sXTrfD4GXU,qme,Reply,29,35,1,0,2696,"<a href=""https://mobile.twitter.com"" rel=""nofollow"">Twitter Web App</a>",,https://dieworkwear.com/2020/09/25/where-to-shop-for-a-suit/,,
3/21/24 21:34,'1770911971300233238',@iamteshonna Just want to say I'm glad you're here and able to experience many more years. ❤️,en,Reply,3,1028,1,1,182253,"<a href=""https://mobile.twitter.com"" rel=""nofollow"">Twitter Web App</a>",,,,
3/21/24 20:58,'1770902793760735552',"@grandmasterfei sport coat + jeans = great

suit jacket + jeans = bad",en,Reply,3,50,2,2,4537,"<a href=""https://mobile.twitter.com"" rel=""nofollow"">Twitter Web App</a>",,,,
3/21/24 20:46,'1770899836100903130',"There are more bespoke tailors and shoemakers in Tokyo than in the US. I wondered why, so I spoke with @McReynoldsJoe, co-author of the new book Emergent Tokyo, about how urban policy affects the growth of small businesses and artisan crafts. 

🔗: https://t.co/y3F8lUhbdm https://t.co/sakSxdTMK7",en,Tweet,203,665,46,16,88900,"<a href=""https://mobile.twitter.com"" rel=""nofollow"">Twitter Web App</a>",,https://blst.to/lyYqsJ0,video,https://video.twimg.com/ext_tw_video/1770899360068567041/pu/vid/avc1/720x1280/_S7VYq_yMCm-G8fd.mp4?tag=12
3/20/24 21:38,'1770550463177662903',$75k for that suit is robbery and not something i would admit to anyone,en,Tweet,594,21425,563,352,2202429,"<a href=""https://mobile.twitter.com"" rel=""nofollow"">Twitter Web App</a>",,,,
3/21/24 18:12,'1770860972183359912',"@RJdeMans @cutupcado kiton is pretty cheap on ebay (like 100 bucks for a jacket). would not be hard to buy one, open it up, and judge directly. hand pad looks very different from machine padding. or someone can just go into a kiton store, flip the lapel, and look for dimples",en,Reply,0,9,1,1,1354,"<a href=""https://mobile.twitter.com"" rel=""nofollow"">Twitter Web App</a>",,,,
3/21/24 7:31,'1770699827074261030',"@SmackRichardson Yes. I think that has already happened to a large degree in the United States, as there aren't many bespoke tailors or shoemakers left here. It has also become harder to find skilled tailors and makers in the UK because the customer base isn't what it used to be",en,Reply,0,72,1,0,2488,"<a href=""https://mobile.twitter.com"" rel=""nofollow"">Twitter Web App</a>",,,,
3/21/24 6:09,'1770679098286981618',"To me, asking how much someone should pay for a suit is like asking how much you should pay for coffee. What flavors do you like? What notes do you enjoy? Developing this sense allows you to figure out what you want out of a garment (and how much you can expect to pay) https://t.co/TLg4hiylfu",en,Reply,11,547,16,1,83277,"<a href=""https://mobile.twitter.com"" rel=""nofollow"">Twitter Web App</a>",,,photo,https://pbs.twimg.com/media/GJK1CLSa4AAmjvx.jpg
3/21/24 6:09,'1770679101386625419',"But certainly, if you pay $75k for what looks to be an ill-fitting, machine-made garment just bc the fabric has gold pinstripes, you've been ripped off. There is no craftsmanship here, only gimmicks. A handmade bespoke Savile Row suit made with quality English cloth is like ~$6k https://t.co/wvovHSCrwY",en,Reply,25,1126,21,19,83229,"<a href=""https://mobile.twitter.com"" rel=""nofollow"">Twitter Web App</a>",,,photo,https://pbs.twimg.com/media/GJK1r7Ra0AAYsoN.jpg
3/21/24 6:09,'1770679096592540064',"However, some people may not care about handwork. They may find bespoke fittings to be a nuisance. They may prefer the convenience of ready-to-wear. This is where developing your own sense of taste and preferences comes in. https://t.co/qrvPrfxIks",en,Reply,5,410,5,3,33656,"<a href=""https://mobile.twitter.com"" rel=""nofollow"">Twitter Web App</a>",,,photo,https://pbs.twimg.com/media/GJK0YnDaAAAczFi.jpg
3/21/24 5:21,'1770666940023083413',"@RJdeMans @cutupcado Really? Not even hand pad stitching? So then what's the handwork? Sleeve, collar, and buttonholes?",en,Reply,0,43,1,1,3803,"<a href=""https://mobile.twitter.com"" rel=""nofollow"">Twitter Web App</a>",,,,
3/21/24 1:40,'1770611461649494451',"What a loss. Greenfield steered an American suit factory during a time when such factories were closing left and right. He tailored for six US Presidents, made suits for films, and helped young American labels such as Rag &amp; Bone and Band of Outsiders develop their lines. A legend",en,Tweet,166,3576,222,23,284192,"<a href=""https://mobile.twitter.com"" rel=""nofollow"">Twitter Web App</a>",,,,
3/20/24 23:08,'1770573120933707945',"@THORmaximalist Owning this toy ($1,000) is now the only proof you've broken out of the matrix. Do you want people to think you're in the matrix? https://t.co/mm7JOMyTU5",en,Reply,24,1946,29,6,50518,"<a href=""https://mobile.twitter.com"" rel=""nofollow"">Twitter Web App</a>",,,photo,https://pbs.twimg.com/media/GJJW18kb0AAL92e.jpg
3/20/24 21:44,'1770551899865104503',@cutupcado i personally dont understand spending that kind of money on a ready-to-wear suit,en,Reply,3,479,1,6,43145,"<a href=""https://mobile.twitter.com"" rel=""nofollow"">Twitter Web App</a>",,,,
3/20/24 21:42,'1770551600450572645',@AleksandrKallus better than his peers but the tailoring is nothing special,en,Reply,4,1015,1,9,57054,"<a href=""https://mobile.twitter.com"" rel=""nofollow"">Twitter Web App</a>",,,,
3/20/24 21:41,'1770551370363679203',@BrianK417 it doesn't exist. no suit is worth $75k,en,Reply,15,4956,49,38,68921,"<a href=""https://mobile.twitter.com"" rel=""nofollow"">Twitter Web App</a>",,,,
3/20/24 8:16,'1770348732783133111',.@ROLEX,qam,Tweet,195,1931,67,67,524212,"<a href=""https://mobile.twitter.com"" rel=""nofollow"">Twitter Web App</a>",,,,
3/20/24 17:31,'1770488327889616995',"@patapackala @GregPeer @ROLEX there are many ways you can have exclusivity without making people buy unrelated stuff they don't want.  you can hold lotteries, for example (as some watch brands do). I agree with pat this is a slimy tactic to move unrelated goods, but I don't know the legality of it.",en,Reply,0,6,1,3,862,"<a href=""https://mobile.twitter.com"" rel=""nofollow"">Twitter Web App</a>",,,,
3/20/24 16:29,'1770472658460889361',the fact that trump might lose housing if he doesn't come up with half a billion dollars by the end of the month is how it feels to live in the bay area,en,Tweet,99,9075,509,35,340887,"<a href=""https://mobile.twitter.com"" rel=""nofollow"">Twitter Web App</a>",,,,
3/20/24 9:50,'1770372431108337724',@patapackala @GregPeer @ROLEX i assume if you buy four billion hats they will allow you to buy a car,en,Reply,0,13,1,2,763,"<a href=""https://mobile.twitter.com"" rel=""nofollow"">Twitter Web App</a>",,,,
3/20/24 8:14,'1770348107538079975',"@LolOverruled Yes, timeless in that they don't belong in any time, either today tomorrow or the day after",en,Reply,20,1876,17,9,36851,"<a href=""https://mobile.twitter.com"" rel=""nofollow"">Twitter Web App</a>",,,,
3/20/24 4:27,'1770291092262678823',i agree https://t.co/cs6YX12r4r,en,Tweet,28,1022,36,6,189534,"<a href=""https://mobile.twitter.com"" rel=""nofollow"">Twitter Web App</a>",,,photo,"https://pbs.twimg.com/media/GJFWV8KacAAji-h.jpg,https://pbs.twimg.com/media/GJFWV8Ja0AEmidm.jpg"
3/20/24 3:15,'1770272919429763173',"tom selleck shows how to dress down a sport coat (combine casual things with casual things, not suit jackets with jeans) https://t.co/0H81x8vbCo",en,Tweet,1069,5832,201,65,372385,"<a href=""https://mobile.twitter.com"" rel=""nofollow"">Twitter Web App</a>",,,photo,"https://pbs.twimg.com/media/GJFFvRxbcAABAkS.jpg,https://pbs.twimg.com/media/GJFFvSKbAAAmNuj.jpg,https://pbs.twimg.com/media/GJFFvSfbIAAwOBw.jpg"
3/20/24 0:23,'1770229631880433848',do men not understand that dressing well is not always about showing off all your muscles?,en,Tweet,570,33128,722,187,1661208,"<a href=""https://mobile.twitter.com"" rel=""nofollow"">Twitter Web App</a>",,,,
3/20/24 0:41,'1770234070183891036',"@NathanDNguyen that's a perfectly fine preference, but depending on the style of the clothes, it may mean tailoring the clothing in a way that makes for an ugly outfit. if someone wants to show off their muscles at the expense of wearing an ugly outfit, then that's their choice",en,Reply,12,2387,18,9,46814,"<a href=""https://mobile.twitter.com"" rel=""nofollow"">Twitter Web App</a>",,,,
3/20/24 0:24,'1770229928958849530',"like, these were toys, not style guides https://t.co/PgaOil2uyt",en,Reply,26,6743,104,35,204599,"<a href=""https://mobile.twitter.com"" rel=""nofollow"">Twitter Web App</a>",,,photo,https://pbs.twimg.com/media/GJEeu4ibYAAq2nb.jpg
3/20/24 0:27,'1770230532926017760',"""whats the point of bodybuilding if no one sees it?""

i don't know man, what's the point of earning a lot of money if you're not going to tape stacks of $100 bills all over your body??",en,Reply,73,9760,223,54,216125,"<a href=""https://mobile.twitter.com"" rel=""nofollow"">Twitter Web App</a>",,,,
3/19/24 22:59,'1770208513840808008',"Dressing well is more about knowledge than money. First Lady Eleanor Roosevelt summed up this sentiment neatly in her book It’s Up to the Women, published during the depths of the Great Depression:",en,Tweet,250,2440,174,23,252615,"<a href=""https://mobile.twitter.com"" rel=""nofollow"">Twitter Web App</a>",,,photo,https://pbs.twimg.com/media/GJEK5JVbEAAmeoM.png
3/19/24 23:37,'1770218145086845303',"@Mihoda if im being honest, i think people's expectations for what's a reasonable price for a garment with multiple panels and seams is kind of crazy. the importation of cheap clothing has dramatically skewed people's perceptions of what a US-based garment worker should be paid",en,Reply,3,186,3,4,3413,"<a href=""https://mobile.twitter.com"" rel=""nofollow"">Twitter Web App</a>",,,,
3/19/24 20:47,'1770175398413816177',"A lot of people assume that a suit can't drape well if you have an athletic figure. But check out this dinner suit Andrea Seoul made for Korean bodybuilder Amotti. Doesn't this look better than McGregor?

IG amottivation
IG andreaseoul_official

(Thanks to Thomas for the tip) https://t.co/sdcbc2Y4Ab",en,Tweet,1660,20365,690,364,1239968,"<a href=""https://mobile.twitter.com"" rel=""nofollow"">Twitter Web App</a>",,,photo,"https://pbs.twimg.com/media/GJDsQTsbYAA8pyb.jpg,https://pbs.twimg.com/media/GJDsQTraUAAFYpu.jpg,https://pbs.twimg.com/media/GJDsQTrasAAc1tg.jpg,https://pbs.twimg.com/media/GJDsQZObgAAw0n9.jpg"
3/19/24 23:24,'1770214729950330967',"@Patrick49012564 ""The thing that makes McGregor look great is he’s one of the most elite athletes of all time. I’m sure those guys are nice people but 10/10 guys would rather be Connor"" https://t.co/apOLVyvfsw",en,Reply,4,594,3,4,22824,"<a href=""https://mobile.twitter.com"" rel=""nofollow"">Twitter Web App</a>",,,photo,"https://pbs.twimg.com/media/GJEQ5pia4AAVTGA.jpg,https://pbs.twimg.com/media/GJEQ5qPaIAAcnIR.jpg"
3/19/24 22:59,'1770208513840808008',"Dressing well is more about knowledge than money. First Lady Eleanor Roosevelt summed up this sentiment neatly in her book It’s Up to the Women, published during the depths of the Great Depression:",en,Tweet,250,2440,174,23,252615,"<a href=""https://mobile.twitter.com"" rel=""nofollow"">Twitter Web App</a>",,,photo,https://pbs.twimg.com/media/GJEK5JVbEAAmeoM.png
3/19/24 22:38,'1770203105709494548',Americans don't recognize good dressmaking nowadays https://t.co/wnVZJPqNGY,en,Tweet,43,2693,105,23,127554,"<a href=""https://mobile.twitter.com"" rel=""nofollow"">Twitter Web App</a>",,,photo,https://pbs.twimg.com/media/GJEGTmwbgAAY7su.jpg
3/19/24 21:10,'1770181137865842826',"@awb20774 McGregor wears custom suits, but his team (from what I've seen) is not made of serious clothing people—more like salespeople. He also has bad taste. There are lots of ways for custom tailoring to go wrong, esp if an unknowledgeable client keeps interfering with the process",en,Reply,12,1294,22,6,38504,"<a href=""https://mobile.twitter.com"" rel=""nofollow"">Twitter Web App</a>",,,,
3/19/24 21:05,'1770179789686452432',"@kettingding The same tailoring principles can be applied to any fabric or style you want. But many do not think about things such as fit and silhouette; they only think about things like a wild color to make an outfit ""interesting."" The effect ends up falling flat. Compare pics 1-3 to 4 https://t.co/jrYlTHp7Uv",en,Reply,101,1464,40,29,52040,"<a href=""https://mobile.twitter.com"" rel=""nofollow"">Twitter Web App</a>",,,photo,"https://pbs.twimg.com/media/GJDxChJaIAA1Xeo.jpg,https://pbs.twimg.com/media/GJDxEi3a8AA4jBk.jpg,https://pbs.twimg.com/media/GJDxEi1awAAp0pY.jpg,https://pbs.twimg.com/media/GJDxFaXaUAAOya7.jpg"
3/19/24 20:57,'1770177848344502661',"@pinskinator In that case, I recommend making the suit out of clear plastic and at least tailoring it well, rather than wearing bad tailoring",en,Reply,22,5218,60,37,63445,"<a href=""https://mobile.twitter.com"" rel=""nofollow"">Twitter Web App</a>",,,,
3/19/24 20:47,'1770175401593028932',No pulling. Clean shoulder and sleevehead. Trousers drape well. Compare to other athletic guys who assume (or want) everything to fit as tightly as possible. https://t.co/ALCuq1dfjX,en,Reply,53,2273,47,16,134156,"<a href=""https://mobile.twitter.com"" rel=""nofollow"">Twitter Web App</a>",,,photo,"https://pbs.twimg.com/media/GJDsq-1bIAAZh9u.jpg,https://pbs.twimg.com/media/GJDsq-2boAAF9oT.jpg,https://pbs.twimg.com/media/GJDsq-1a4AAGV1N.jpg,https://pbs.twimg.com/media/GJDtEdubsAAQs9K.jpg"
3/19/24 0:41,'1769871673531273378',we need to bring back the flared leg/ bootcut pant https://t.co/pgTubdUVyb,en,Tweet,342,4954,241,276,346912,"<a href=""https://mobile.twitter.com"" rel=""nofollow"">Twitter Web App</a>",,,photo,"https://pbs.twimg.com/media/GI_Y5Q6bQAAlymB.jpg,https://pbs.twimg.com/media/GI_Y5RWbwAAjya0.jpg,https://pbs.twimg.com/media/GI_Y5SJbMAA-x2K.jpg,https://pbs.twimg.com/media/GI_Y5Q6bgAAY1w1.jpg"
3/19/24 7:17,'1769971534880178444',@eddiestats @rhunterh i think the shoulder looks great and goes with this style. a shoulder does not always have to sit right on your shoulder bone. https://t.co/SPY0yjEttL,en,Reply,3,36,2,1,3179,"<a href=""https://mobile.twitter.com"" rel=""nofollow"">Twitter Web App</a>",,,photo,"https://pbs.twimg.com/media/GJAzudraIAAjZMN.jpg,https://pbs.twimg.com/media/GJAzudoaEAAKlqI.jpg,https://pbs.twimg.com/media/GJAzudpbAAAqiG9.jpg,https://pbs.twimg.com/media/GJAzudoboAAN8CB.jpg"
3/19/24 4:56,'1769935898291179790',im just a menswear guy standing in front of government officials asking them to build more housing,en,Tweet,11,1153,84,14,99576,"<a href=""https://mobile.twitter.com"" rel=""nofollow"">Twitter Web App</a>",,,,
3/19/24 3:44,'1769917887966552253',"if i was a white woman, i would take a blurry photo of myself and sell it to a British outlet for $500",en,Tweet,288,33986,1754,77,1201007,"<a href=""https://mobile.twitter.com"" rel=""nofollow"">Twitter Web App</a>",,,,
3/19/24 4:21,'1769927091515277344',@JJ_MKE i would just put on a barbour jacket,en,Reply,0,287,1,2,12108,"<a href=""https://mobile.twitter.com"" rel=""nofollow"">Twitter Web App</a>",,,,
3/19/24 3:49,'1769919079073435920',i dont know how many british outlets there are. maybe a dozen? you could sell a different blurry photo to each one and then sell a story about how you sold a dozen blurry photos. this is like $7k for a week's worth of work.,en,Reply,6,1297,31,7,88165,"<a href=""https://mobile.twitter.com"" rel=""nofollow"">Twitter Web App</a>",,,,
